{"authority":"official-first-party","authority_registry_id":"venue-authority-registry-v1","authority_registry_locator":"references/venue-authorities.json","retrieved_at":"2026-07-28T07:56:49Z","schema_version":"1.0.0","sources":[{"authority":"first_party","content_locator":"venues/source-evidence/cvpr-2026-reviewer-guidelines.json","content_sha256":"dd9bd7062be063cac08dc50a5096f649c194adec2ec51aeb53e1a4fb47000e3b","retrieved_section_anchors":["how-to-write-good-reviews"],"source_id":"cvpr-2026-reviewer-guidelines","title":"CVPR 2026 Reviewer Guidelines","url":"https://cvpr.thecvf.com/Conferences/2026/ReviewerGuidelines"},{"authority":"first_party","content_locator":"venues/source-evidence/cvpr-2026-training.json","content_sha256":"c7f1dfed7bba362281904d074b0742ea3717f0b2e3487c83ea7de684306ddf5a","retrieved_section_anchors":["review-content","finalization"],"source_id":"cvpr-2026-training","title":"CVPR 2026 Reviewer Training Material","url":"https://cvpr.thecvf.com/Conferences/2026/ReviewerTrainingMaterial"},{"authority":"first_party","content_locator":"venues/source-evidence/cvpr-2026-ac-guidelines.json","content_sha256":"fbd940bad623c92d45c6d7c432ae2e7e51a9c2ae87458b8d4b0abc6d8dfe3e8b","retrieved_section_anchors":["meta-review"],"source_id":"cvpr-2026-ac-guidelines","title":"CVPR 2026 Area Chair Guidelines","url":"https://cvpr.thecvf.com/Conferences/2026/ACGuides"}],"track":"main","venue":"CVPR","year":2026}
