{"authority":"official-first-party","authority_registry_id":"venue-authority-registry-v1","authority_registry_locator":"references/venue-authorities.json","retrieved_at":"2026-07-28T07:56:49Z","schema_version":"1.0.0","sources":[{"authority":"first_party","content_locator":"venues/source-evidence/eccv-2026-reviewer-guide.json","content_sha256":"9fe3816a3703e7a13507e34903dfa40dda6e21b4b86486acb2243bcfb9c3fd12","retrieved_section_anchors":["reviewer-guidelines"],"source_id":"eccv-2026-reviewer-guide","title":"ECCV 2026 Reviewer Guidelines","url":"https://eccv.ecva.net/Conferences/2026/ReviewerGuide"},{"authority":"first_party","content_locator":"venues/source-evidence/eccv-2026-contribution-types.json","content_sha256":"ce68d26440702cfaa44ff0523c9b7f98ae22bdd19edc3176e88e1b10df7c95fb","retrieved_section_anchors":["contribution-type-interpretation"],"source_id":"eccv-2026-contribution-types","title":"ECCV 2026 Guidance on Contribution Types","url":"https://eccv.ecva.net/Conferences/2026/ReviewerContributionTypes"},{"authority":"first_party","content_locator":"venues/source-evidence/eccv-2026-ac-guidelines.json","content_sha256":"e9f1389abed421ed459711b197885109f427b680d50a3eb1c1ad35a3c7064ded","retrieved_section_anchors":["final-justification","meta-review"],"source_id":"eccv-2026-ac-guidelines","title":"ECCV 2026 Area Chair Guidelines","url":"https://eccv.ecva.net/Conferences/2026/ACGuideLines"}],"track":"main","venue":"ECCV","year":2026}
