{"authority":"official-first-party","authority_registry_id":"venue-authority-registry-v1","authority_registry_locator":"references/venue-authorities.json","retrieved_at":"2026-07-28T07:56:49Z","schema_version":"1.0.0","sources":[{"authority":"first_party","content_locator":"venues/source-evidence/tmlr-acceptance-criteria.json","content_sha256":"99da3a770eca00e706cdfebf3be5411fa7e760f530127ae734840998dce39a3e","retrieved_section_anchors":["acceptance-criteria"],"source_id":"tmlr-acceptance-criteria","title":"TMLR Acceptance Criteria","url":"https://jmlr.org/tmlr/acceptance-criteria.html"},{"authority":"first_party","content_locator":"venues/source-evidence/tmlr-reviewer-guide.json","content_sha256":"d4fade94b802d739688bd38c14d8f840443892283a2b380a0810d2d7de5c8a2f","retrieved_section_anchors":["review-format","official-recommendation"],"source_id":"tmlr-reviewer-guide","title":"TMLR Reviewer Guide","url":"https://jmlr.org/tmlr/reviewer-guide.html"},{"authority":"first_party","content_locator":"venues/source-evidence/tmlr-ae-guide.json","content_sha256":"eb20498d7ffa1ce1783c6b4c5b3a0274545f8b6c388a20e309aca754518c8417","retrieved_section_anchors":["action-editor-outcomes"],"source_id":"tmlr-ae-guide","title":"TMLR Action Editor Guide","url":"https://jmlr.org/tmlr/ae-guide.html"}],"track":null,"venue":"TMLR","year":null}
