{"authority":"official-first-party","authority_registry_id":"venue-authority-registry-v1","authority_registry_locator":"references/venue-authorities.json","retrieved_at":"2026-07-28T07:56:49Z","schema_version":"1.0.0","sources":[{"authority":"first_party","content_locator":"venues/source-evidence/icml-2026-reviewer-instructions.json","content_sha256":"88ba1e5360956ed62787baf8bfaa991e93a7d71bfa3c9f3b06f4412a0df450ff","retrieved_section_anchors":["evaluation-dimensions","overall-recommendation","confidence","final-justification"],"source_id":"icml-2026-reviewer-instructions","title":"ICML 2026 Main Track Reviewer Form Instructions","url":"https://icml.cc/Conferences/2026/ReviewerInstructions"},{"authority":"first_party","content_locator":"venues/source-evidence/icml-2026-ac-instructions.json","content_sha256":"f9225085a3f11b9e45714c224a6ed705f706c226af74bf47d204b150c7c474f2","retrieved_section_anchors":["meta-reviews"],"source_id":"icml-2026-ac-instructions","title":"ICML 2026 Area Chair Instructions","url":"https://icml.cc/Conferences/2026/AreaChairInstructions"}],"track":"main","venue":"ICML","year":2026}
